日期,工作名稱,公司名稱,公司地址,薪資,工作內容,地區,經歷,學歷,公司人數,文章編號,工作網址
8/10,兒童程式設計師/講師（台中地區）,睿智教育股份有限公司,台中市南屯區向上南路一段327號,400,歡迎具有耐性、喜歡與小孩子互動、對教學有熱忱的你，加入我們全台各地的教學團隊，一起帶領孩子快樂學習！ ​【 為什麼加入CodePro 團隊？】大部分人對於老師的想像可能都停留在所謂：「師者，所以傳道、授業、解惑也」。然而，在 CodePro 教學團隊不只是教學，自己在「軟實力」上也會有很大的進步：因為我們都在把「複雜的概念講的淺顯易懂」。因此，CodePro 教學團隊不乏有：爸爸媽媽、工程師、PM、老師、室內設計師、護理師... 等。 CodePro 教學團隊更像是一個社群。不論資電科系與否，我們一起在這交流心得與機會，共同創造無限可能。【 教學內容 】我們的學生涵括幼稚園大班到高中生（K12）都有。我們將依個人背景（因此，請讓我們認識你／妳）與經驗指派合適的教學現場。對於初入教育的夥伴們，我們也將優先安排接受專業的教育訓練。期待你/妳與我們一起以互動有趣的方式帶領孩子學習！【 我們期待你有 】1. 願意細心且耐心的教導孩子 2. 遇到突發狀況，有基本的應變能力 3. 願意在課後與家長溝通學生上課學習情況4. 教學經驗（畢竟是教學工作，如果你有相關經驗當然是加分，沒有也沒關係，我們可以協助你）【 加入我們 】CodePro 酷博兒童程式教育重視每位孩子上課的過程，透過引導式的活潑教學，讓教課的老師不單單只是教導學生，更是在這樣的學習環境下一同做中學學中做的與孩子一起成長。我們期待你對教學富有極大熱忱，同時對於教學有更多元的想法，那你就是我們正在找尋的夥伴，若你有符合以上的具備條件，請隨時聯繫我們！※ 授課地點：雙北地區、桃園市、新竹市、台中市、台南市 我們將依上述地點優先安排，若您不在上述地區也沒有關係，還是歡迎您聯繫我們，讓我們有機會與您進一步聯繫。,台中市南屯區,經歷不拘,大學,員工10人,7viuc,www.104.com.tw/job/7viuc?jobsource=jolist_c_relevance
5/18,數據分析師,傲群科技有限公司,台中市西屯區朝富路213號14樓A1,"50,000",1. 規劃並執行各類研究調查專案。2. 管控問卷資料的品質，包括訪員訓練、複核問卷、側聽及輔導等管理工作。3. 進行調查數據的彙整、除錯，分析調查數據與繪製統計圖表，並撰寫分析建議報告。4. 收集及分析市場情報（如：消費者的人口特性、偏好、需求與購買習慣，以及競爭者的品牌形象、價格、產品、通路及行銷方案等）。. 分析企業統計數據（如：營業額、銷售量、客戶數等，預測與追蹤市場和銷售的趨勢）。,台中市西屯區,經歷不拘,學歷不拘,員工30人,7vpyk,www.104.com.tw/job/7vpyk?jobsource=jolist_d_relevance
8/31,【高雄】TE工程師,凱銳光電股份有限公司,高雄市前鎮區,待遇面議,1. 新產品測試程式開發。2. EMS/OEM新機種測試移交。3. 測試程式維護及異常處理。4. 自動化治具程式撰寫。. 導入SFIS自動化測試程式。6. 協助產品測試驗證作業及試產測試。7. 零件規格承認書確認發行。8. 其他主管交辦事項。,高雄市前鎮區,2年以上,大學,員工550人,7etm3,www.104.com.tw/job/7etm3?jobsource=jolist_d_relevance
9/06,"Business Analyst, Solutions Consultant ",主橙資訊科技股份有限公司,台中市西區公益路161號10樓之2(近勤美綠園道),待遇面議,"1. 熟悉Python  Tableau 或Power BI等資料清洗與程式編寫2.Tableau 軟體架構功能測試應用發展3. 數據應用分析與顧問服務• Scope the business requirements,",台中市西區,1年以上,大學,,6yssq,www.104.com.tw/job/6yssq?jobsource=jolist_d_relevance
7/22,自動化測試工程師,永鼎數位科技有限公司,台中市西區台灣大道二段285號,"30,000",工作內容:1. 建置/維護自動化測試環境及架構2. 撰寫測試案例、執行測試工作、產出測試報告。3. 開發自動化測試程式。4. 針對未自動化部分進行手動測試。. 協助公司系統上線前後的測試檢查。,台中市西區,1年以上,專科,,76l81,www.104.com.tw/job/76l81?jobsource=jolist_d_relevance
9/01,System Engineering Manager of Smart Production Line _DSM_OT (Taichung/台中),台達電子工業股份有限公司 _DELTA ELECTRONICS INC.,台中市西屯區科園一路8號,待遇面議,"1.	Proceed Product Process Analysis with Product Design Team to design the aligned equipment and production line2.	Use Related Tool to describe the requirement from product design and production team to communicate well to finalize the production line design for the optimized smart manufacture features.3.	Select and decide the related process equipment requirement to meet smart production line’s strategic goal 4.	Define system specification of the related equipment and production line meeting Delta DSM strategic goals and proceed the system design.	Coordinate related design team such as smart machine design team, related smart production line design team including mechanical design & Electromechanical team, Electrical/Electronics Team, Software Design Team, and Information management team) to complete the smart production line to meet the requirement and validated together with users well6.	Leading the technology transfer for the production line POC to Diligent Team for duplication and to keep the solution keeping the excelsior. 7.	Leading OT Team project members to coordinate with IoT Team and IT Team with production line well parameters and data collected for AI intelligent self-learning for continuous optimization for production line built-in, edge-computing, mist, and/or cloud computing for the optimized smart manufacturing. ",台中市西屯區,3年以上,碩士,上市上櫃,7tg99,www.104.com.tw/job/7tg99?jobsource=jolist_d_relevance
9/07,軟體自動化測試工程師 QA Engineer,肚肚股份有限公司,高雄市前鎮區成功二路25號12樓,待遇面議,寫測試報告9. 提供測試報告和建議以保障產品可測性和架構合理性【職務要求】1.程式設計與撰寫能力：自動化測試工程師需要具備至少一種程式語言的編程和撰寫能力，如Python、Java、C#等，以便撰寫自動化測試腳本和工具。2.測試框架和工,高雄市前鎮區,1年以上,大學,,7kvby,www.104.com.tw/job/7kvby?jobsource=jolist_d_relevance
9/05,軟體開發工程師 Software / Development Engineer,新加坡商羅福斯有限公司台灣分公司,台中市西區台灣大道2段,"42,000","1. 負責軟體分析、設計以及程式撰寫。2. 現有系統程式維護與開發。3. 規劃執行軟體架構及模組之設計，並控管軟體設計進度。 4. 進行軟體之測試與修改。. 協助研發軟體新技術與新工具。6. 具有良好溝通、協調、組織、團隊合作能力。7. 熱衷於學習各種工業加工製程知識。8. 需配合專案需求出差。1. Responsible for software analysis, design and programming.2. Maintenance and development of existing system programs.3. Plan and execute software architecture, module design and manage the software design process.4. Test and modify the software.. Assist in the development of new software technologies and new tools.6. Good communication, coordination, organization and teamwork skills.7. Enthusiastic about learning various industrial process knowledge.8. Need a business trip for the job.    ",台中市西區,經歷不拘,專科,外商公司,6zmdq,www.104.com.tw/job/6zmdq?jobsource=jolist_d_relevance
7/31,智慧製造程式設計工程師,國聯機械實業股份有限公司,高雄市岡山區本工東二路38號,"35,000",==================== ★VB.Net、C#、MS SQL Server、系統分析與程式設計能力。 ☆有MES系統維護經驗或現場製程經驗尤佳。 ★Mongo DB、Python 大數據應用。歡迎,高雄市岡山區,2年以上,專科,員工50人,81cp6,www.104.com.tw/job/81cp6?jobsource=jolist_d_relevance
9/05,技術工程類 - 軟體設計工程師 - AI【高雄】,日月光半導體製造股份有限公司,高雄市楠梓區經三路26號,"38,000",應數位企業發展需求，將進行AI相關技術導入，整合供應鏈管理與客戶服務1. 協助定義專案分析的範圍以及方法論，定義假說以及指標，調整設計數據模型2. 將商業問題轉化為可分析的條件以及狀態3. 定義解決方法步驟的優先度4. 使用統計，數學，機器學習等方法分析生產活動產生的資料. 開發分析工具套件協助分析6. 設計建立預測工具，並尋找分析資料產生的新洞見*********************************************我們運用新興IT資訊科技，開發自動化、智慧化、行動化等應用，創造 IT 的價值，以引領公司創新與突破。日月光公司在半導體封裝、測試領域排名世界第一，與國內外頂尖企業互動密切，能提供你連結全世界的國際化舞台；歡迎有志一同的人才菁英加入我們的團隊，一起迎接挑戰，揮灑你的創意，成就個人精彩卓越的職涯。*********************************************,高雄市楠梓區,經歷不拘,大學,上市上櫃,74iur,www.104.com.tw/job/74iur?jobsource=jolist_d_relevance
9/01,PHP、Perl 程式設計工程師(高雄),桓基科技股份有限公司,高雄市前鎮區復興四路 12 號 7F-12,"42,000",1.負責Web系統程式開發、設計及維護，熟PHP、jQuery語言，具MySQL資料庫處理能力。2.熟CentOS/ Red Hat Linux系統操作。Perl 或Python為加分項目。3.具系統設計及開發建置2年以上經驗為佳。4 具,高雄市前鎮區,經歷不拘,大學,員工90人,7h60g,www.104.com.tw/job/7h60g?jobsource=jolist_d_relevance
8/30,自動化與軟體研發工程師 (助理工程師/工程師/系統分析師/專案經理人),明億鑫精密股份有限公司,台中市神岡區東洲路269號,"32,000"," Windows Form , MVC■ Python語言■ 物件導向程式設計觀念■ SQL語法■ 關聯式資料庫設計■ 基礎數學應用 (代數、三角函數、空間幾何)-----------------------------------------",台中市神岡區,經歷不拘,專科,員工33人,6tomz,www.104.com.tw/job/6tomz?jobsource=jolist_d_relevance
9/07,影像處理軟體工程師,大立光電股份有限公司,台中市南屯區精科路11號,待遇面議,1.光學設備軟體開發2.影像處理軟體開發,台中市南屯區,經歷不拘,碩士,上市上櫃,wet8,www.104.com.tw/job/wet8?jobsource=jolist_d_relevance
8/31,聲學工程師,弘益生態有限公司,台中市烏日區三和路68號,待遇面議,1.水下噪音與聲學現場量測工作、數據分析、報告製作。 2.專案管理與執行。3.檢驗室文件維護。 4.須配合量測工作出差。,台中市烏日區,經歷不拘,大學,,7lc3i,www.104.com.tw/job/7lc3i?jobsource=jolist_d_relevance
5/18,數據分析師,傲群科技有限公司,台中市西屯區朝富路213號14樓A1,"50,000",•  發現問題、發揮數據價值為導向，能深入理解內部需求與痛點，確定問題與目標，並給予有效的數據解決方案。•  挖掘數據Insight，讓數據提升價值，協助各單位靈活運用數據分析結果。•  運用Tableau 多維度分析工具，完成數據管理、分析與應用全流程工作。 •  熟悉資料庫與SQL語句應用。•  熟悉 ETL 資料整合應用。•  熟悉Excel繪圖工具與基本函式運用。 •  熟悉GA/GTM 工具應用及分析。,台中市西屯區,2年以上,學歷不拘,員工30人,7wyci,www.104.com.tw/job/7wyci?jobsource=jolist_d_relevance
8/28,物聯網工程師,基士德環科股份有限公司,高雄市鼓山區民利街19號,"32,000",物聯網整合服務，從終端設備資料(感測器)串連到資訊整合上傳水務資訊平台，並維護及校正終端設備。 1. 電信、弱電工程規劃與施工2. 終端設備維護與校正 3. 進行前端與後端整合測試並撰寫相關技術文件 4. 針對解決方案/產品/專案相關內容能與相關團隊做討論和整合,高雄市鼓山區,1年以上,專科,員工40人,7cki9,www.104.com.tw/job/7cki9?jobsource=jolist_d_relevance
9/05,研發替代役-應用工程師(台南辦公室),誠雲科技股份有限公司,台南市中西區B211,待遇面議,1. IOT/WinNexus軟體開發與測試，IOT硬體與模組設計與測試。2. 微控制器(MCU)程式編程。3. 專利撰寫與發表。加入誠雲科技，可以在有經驗的同事帶領下，學習運用所學，做出世界級大公司所需要的解決方案，測試驗證並且推展商品。公司將按照所學與興趣安排適合的位置。,台南市中西區,經歷不拘,碩士,員工30人,7puui,www.104.com.tw/job/7puui?jobsource=jolist_d_relevance
8/29,測試助理 (高雄),騰雲科技服務股份有限公司,高雄市前金區中華三路108號8樓A室,"28,000",「科技創造智慧生活」搶先將金融科技與零售科技融合是我們的現況，不斷追求服務與創新是我們的目標，研發創生態並貼近生活的應用是我們團隊的願景，立足台灣邁向國際是我們的下一步。「主要工作項目」1. 測試腳本撰寫/執行、人工測試、查看Log及完善BUG內容2. 協助公司行政事務處理、督促環境整潔、資產管理及部門事務協調聯繫3. 主管交辦事務- 熟CI (Continuous Integration)者 佳- 有志往開發軟體發展者如果您渴望找一個能自由發揮、活力十足的伙伴、不斷學習新技術的團隊，請當面和我們聊聊！,高雄市前金區,經歷不拘,專科,員工200人,6siqy,www.104.com.tw/job/6siqy?jobsource=jolist_d_relevance
9/07,【EATING-OUT 外帶平台】Product Developer (開發研究員),快帶科技有限公司,台南市中西區民生路二段76號4樓A3,待遇面議,【品牌理念】https://www.eating-out.co/EATING-OUT 是一個開發中並主打免費使用的外帶平台。我們發現市場上雖已有許多類似服務，但時至今日透過電話點餐仍是多數人的選擇。因為與電話的普及率相比，線上點餐服務的普及程度還相差甚遠。而對許多餐飲業者來說，月費、年費或高額抽成往往會成為阻礙他們加入的門檻。因此，我們採用 Freemium 商業模式作為核心策略，透過免費使用來吸引餐廳與消費者加入，並以『全國普及率第一』為目標邁進！【產品現況】· 23Q3 餐廳用 iOS & Android APP 開發 (進行中)· 23Q2 顧客用 iOS & Android APP 開發· 23Q1 伺服端開發· 22Q4 產品分析*預計於 24Q1 正式上線營運【職位需求】作為 EATING-OUT 的 Pro Developer 您的使命是協助打造一個穩定的、可擴充的、可測試的系統，並且接受全端工程師(Full Stack Engineer)的訓練，與公司一同成長往更優秀的工程師邁進！以下工作內容將視實際情況調整：1.使用 Dart(/Flutter) 開發多平台的 APP (Android / iOS / Web)。2.使用 Golang 開發微服務(Microservice)架構之後端。3.制定 RESTful API 規格與開發。【獎金與福利】· 提供認股權，讓您共同享受努力投入所帶來的回報· 不補班、生日假、重要節慶提前放假· 彈性上下班時間(早到早走、晚到晚走)· 每季 Company meeting & 聚餐，與您同步公司推展進程· 每週五下午茶，吃遍國華街甜點· 免費零食飲料，隨時補充體力,台南市中西區,經歷不拘,碩士,,7tnf6,www.104.com.tw/job/7tnf6?jobsource=jolist_d_relevance
9/01,"Software Engineer, Front-end Developer",長佳智能股份有限公司,台中市西區台灣大道二段573號8樓,"40,000",1.負責開發與維護網站前端程式(Vue.js)2.網頁前端程式撰寫（Vue、Vuex、Vue Router、canvas、Nuxt.js）3.與產品經理、設計師、後端工程師合作實現產品界面及功能開發4.解決各種瀏覽器相容性問題.依產品規格文件、進行切版、前端模組和元件開發6.開發文件撰寫,台中市西區,2年以上,大學,員工70人,82uam,www.104.com.tw/job/82uam?jobsource=jolist_d_relevance
9/03,後端工程師Junior Backend Engineer,慧穩科技股份有限公司,台中市西屯區市政路500號7樓之6,待遇面議,工作內容:1、負責開發、維護後端Django專案2、負責REST API的開發，優化產品效能3、撰寫設計開發文件必備條件:1、熟悉Python程式撰寫。2、熟悉Database設計、開發、測試3、熟悉Git工具使用4、熟悉,台中市西屯區,經歷不拘,大學,,793ve,www.104.com.tw/job/793ve?jobsource=jolist_d_relevance
9/05,Ogloba - 自動化測試開發工程師,金永立有限公司,台中市西區華美西街一段137號10樓之3,"40,000",試報告Skill:- 測試理論及流程 - Python- Robot Framework加分:- 任一種Scripting語言- Git- Robot Framework- Appium-,台中市西區,1年以上,專科,員工100人,6i2at,www.104.com.tw/job/6i2at?jobsource=jolist_b_relevance
5/18,助理工程師,傲群科技有限公司,台中市西屯區朝富路213號14樓A1,"31,000",1. 協助軟體研發及文件整理2. 協助軟體功能開發及測試3. 協助專案開發4. 進行軟體之測試與修改. 產品實驗與撰寫實驗報告6. 協助部門行政作業,台中市西屯區,1年以上,學歷不拘,員工30人,7wycm,www.104.com.tw/job/7wycm?jobsource=jolist_b_relevance
8/31,UI美工設計,艾瑞蒙科技有限公司,台南市安平區育平九街229號,"27,000",智慧控制介面UI設計、美術設計、社群平台發文介紹、資料整理,台南市安平區,經歷不拘,學歷不拘,,835qu,www.104.com.tw/job/835qu?jobsource=jolist_b_relevance
8/03,(CS20)軟體應用工程師-台南,新唐科技股份有限公司,台南市歸仁區歸仁區武當路111 號,待遇面議,"【本職缺僅接受新唐科技招募網站投遞】請至新唐科技招募網站投遞個人履歷表，此職缺履歷登錄網址：https://jobs.nuvoton.com/1. Develop BSP for BMC SOC(bootloader, Linux kernel driver, openbmc, yocto)2. Develop SW stack of applications3. Develop application prototypes involving SOC and MCU4. Service customer's requests and on-site support.",台南市歸仁區,2年以上,碩士,員工1500人,6y5k3,www.104.com.tw/job/6y5k3?jobsource=jolist_b_relevance
9/06,A.24 資訊安全 工程師,創逸科技服務有限公司,高雄市苓雅區,"30,000",資訊安全技術檢測作業，包含下列服務：    1.	資訊架構檢視    2.	網路惡意活動檢視    3.	伺服器主機安全設定檢視    4.	滲透測試    5.	弱點掃描    6.	電子郵件社交工程    7.  報告整理與製作,高雄市苓雅區,1年以上,大學,,7r83n,www.104.com.tw/job/7r83n?jobsource=jolist_b_relevance
8/25,(Sr.) SQA Engineer(Python) - Tainan/Hybrid,Zealogics Taiwan_美商邏輯技術有限公司台灣分公司,台南市新市區,待遇面議,	Good in Mandarin and English. •	At least 1 ~ 2 years SQA experience •	Must have python language and  Automation test,台南市新市區,3年以上,大學,員工100人,7s2wa,www.104.com.tw/job/7s2wa?jobsource=jolist_b_relevance
9/06,高級軟體工程師,主橙資訊科技股份有限公司,台中市西區公益路161號10樓之2(近勤美綠園道),"60,000",1.負責軟體之分析、設計以及程式撰寫。2.規劃執行軟體架構及模組之設計，並控管軟體設計進度。,台中市西區,3年以上,專科,,6r284,www.104.com.tw/job/6r284?jobsource=jolist_b_relevance
8/31,軟體設計工程師(四組),康和綜合證券股份有限公司,高雄市新興區中正三路55號17樓,待遇面議,"康和證券近年積極布局金融科技與創新，專注下列特色，歡迎有志同仁一同加入。1. 擁抱金融創新2. 自製核心系統3. 導入新型技術 (eg. container, k8s, elk, grafana...)主要專案:高速證券交易行情系統高速證券交易下單系統採用新技術與架構達成:客戶端跨語言、跨平台伺服端高併發、高可用、可水平擴展歡迎喜歡挑戰，對系統開發，金融交易有興趣的夥伴一同聊聊職務內容:- 前後端程式設計與開發- 程式維護與除錯    ",高雄市新興區,經歷不拘,大學,上市上櫃,7o8fd,www.104.com.tw/job/7o8fd?jobsource=jolist_b_relevance
9/02,Backend Engineer後端工程師,第一通用科技有限公司,台南市南區安平工業區新愛路6號,180~200,【工作內容】1. 使用JavaScript 、H5、C++、UE5、 unity、Python程式語開發系統後端程式 2. 系統功能開發、測試、維護3. web API開發、維護4.調用Odoo等類開源二次開發服務.Andriod/,台南市南區,5年以上,學歷不拘,員工92人,83575,www.104.com.tw/job/83575?jobsource=jolist_b_relevance
8/31,軟體工程師,中揚光電股份有限公司,台中市南屯區工業區二十二路21號,"35,000",你熱愛軟體工程嗎？我們正在找尋熱衷於程式語言開發、軟體設計等的軟體工程師加入我們的團隊！如果你對於這些領域充滿熱情，即便沒有經驗，只要想要挑戰自己，我們都歡迎你的加入。工作內容：1.根據專案需求使用程式語言進行開發設計。2.參與軟體介面設計和開發，打造直覺且易用的介面。3.負責程式設計和系統開發，建立高效且可擴展的軟體系統。4.探索最新的技術趨勢，進行先進技術研究。.根據主管指示完成相關工作。,台中市南屯區,經歷不拘,專科,員工300人,7klez,www.104.com.tw/job/7klez?jobsource=jolist_b_relevance
8/29,軟體類--Data Scientist Engineer (高雄),華邦電子股份有限公司,高雄市路竹區路科五路35號,待遇面議,【邀請您將104履歷同步上傳至華邦官方網站，將使您的履歷優先被主管看見】投遞網址:https://bit.ly/3QZd1v41. R2R 製程控制開發維運2. FDC 機台監控與分析應用3. 資料科學與機器學習專案開發4. 建立及維護 MLOps/DevOps 相關系統,高雄市路竹區,經歷不拘,碩士,上市上櫃,83ibt,www.104.com.tw/job/83ibt?jobsource=jolist_b_relevance
9/05,演算工程助理,穎利科研國際事業有限公司,台中市西區台灣大道二段2號9樓之3,"27,000",徵求 有高度學習意願、有Python等程式語言基本編程技能的「演算工程助理」！ChatGPT引發革命性開發熱潮及廣泛應用，讓各行各業有了加速升級的契機！「學會操作AI」更成為現代職場的必要顯學！穎利科研公司是擅長應用生成式AI協作的軟體開,台中市西區,經歷不拘,專科,員工8人,75gob,www.104.com.tw/job/75gob?jobsource=jolist_b_relevance
9/05,中區資訊室程式設計師（工作地點：台中慈院）,佛教慈濟醫療財團法人,台中市潭子區豐興路一段66號,"30,000",◆ 中區資訊室程式設計師（工作地點：台中慈院）　1.大學(含)以上，資訊或醫療資訊相關科系畢業。　2.工作經驗不拘，有資訊相關產業背景尤佳。　3.具資料庫、演算法知識及資訊技能：ASP.NET、Java、PHP、Python、,台中市潭子區,經歷不拘,大學,,7t8kv,www.104.com.tw/job/7t8kv?jobsource=jolist_b_relevance
9/04,專案組系統整合暨研發工程師,采易資訊系統股份有限公司,台中市西屯區黎明路二段895之一號,"35,000",(必要).熟Java(必要)以下為優選:6.熟Python7.熟Vmware、網路、Hyper-v..等系統(優先錄取選項)8.熟Perl.Rest API各種不同系統介接需求(優先錄取選項)9.熟MySQL.MS-SQL資料庫管理,台中市西屯區,經歷不拘,專科,員工25人,7htg6,www.104.com.tw/job/7htg6?jobsource=jolist_b_relevance
9/05,人工智慧系統開發工程師,馬森科技股份有限公司,台中市南屯區大墩五街306號,"54,000",1.協助加工之分析、轉化為所需邏輯與演算法。2.規劃執行演算架構及程式設計。3.進行實際製程測試與修改演算。4.規劃、執行與維護演算法品質。.協助研發軟體部分功能與新技術。,台中市南屯區,3年以上,大學,員工28人,77cxg,www.104.com.tw/job/77cxg?jobsource=jolist_b_relevance
9/01,【擴編徵才】系統維運工程師(需輪班),聯訊網路有限公司,台中市西區(依照公司規定分派),"50,000","1. 負責第一線障礙排除、問題處理與通報，需配合公司輪班(約一至兩個月換一次班別)2. 負責伺服器系統與網路的日常管理和維護，以確保健康,最大化系統可用性和服務品質3. 紀錄報修事件、處理、追蹤以及回報處理狀況。4. 執行、整理和更新工作相關SOP文件。.排休制(依照當月紅字天數計算)6.另有輪班津貼(另給，不算在洽談薪資內)，中班5000/月，夜班10000/月(不足月照天數算)7.須能接受輪班，無法配合請勿投遞8.無相關經驗請勿投遞",台中市西區,1年以上,大學,,75xnj,www.104.com.tw/job/75xnj?jobsource=jolist_b_relevance
9/05,後端工程師【代徵】,天河國際法律事務所,高雄市前鎮區,"40,000",此職務任職於數位資訊公司，主營判決檢索系統，上班地點為高雄市前鎮區中山二路(近大遠百)。1. 公司現有後端平台日常維護、效能維護及開發。2. 優化後端程式功能設計，資料處理及應用。3. 熟悉Python等程式語言。4. 熟悉,高雄市前鎮區,1年以上,專科,,7xojm,www.104.com.tw/job/7xojm?jobsource=jolist_b_relevance
